{
  "version": 1,
  "empreinte_donnees": "44cbec923709aacdf9753859fd0290d83b293a4e1a24aab2b680791c95a5e264",
  "provisoire": true,
  "population": [
    "arthaud-nathalie",
    "attal-gabriel",
    "dupont-aignan-nicolas",
    "le-pen-marine",
    "lisnard-david",
    "melenchon-jean-luc",
    "philippe-edouard",
    "retailleau-bruno",
    "roussel-fabien"
  ],
  "candidats_evalues": 9,
  "seuil_candidats_codes": 4,
  "d_max": 2.666667,
  "questions": {
    "DEF-001": {
      "theme": "defense",
      "axe": "economie",
      "sens": 1,
      "candidats_codes": 5,
      "couverture": 0.555556,
      "variance": 0.96,
      "D": 0.533333
    },
    "DEF-002": {
      "theme": "defense",
      "axe": "economie",
      "sens": -1,
      "candidats_codes": 2,
      "couverture": 0.222222,
      "variance": null,
      "D": null
    },
    "DEF-003": {
      "theme": "defense",
      "axe": "securite",
      "sens": -1,
      "candidats_codes": 4,
      "couverture": 0.444444,
      "variance": 1.6875,
      "D": 0.75
    },
    "DEF-004": {
      "theme": "defense",
      "axe": "europe",
      "sens": -1,
      "candidats_codes": 4,
      "couverture": 0.444444,
      "variance": 0.1875,
      "D": 0.083333
    },
    "DEF-005": {
      "theme": "defense",
      "axe": "europe",
      "sens": -1,
      "candidats_codes": 7,
      "couverture": 0.777778,
      "variance": 2.285714,
      "D": 1.777778
    },
    "DEF-006": {
      "theme": "defense",
      "axe": "europe",
      "sens": 1,
      "candidats_codes": 5,
      "couverture": 0.555556,
      "variance": 1.44,
      "D": 0.8
    },
    "DEF-007": {
      "theme": "defense",
      "axe": "europe",
      "sens": 1,
      "candidats_codes": 2,
      "couverture": 0.222222,
      "variance": null,
      "D": null
    },
    "DEF-008": {
      "theme": "defense",
      "axe": "europe",
      "sens": 1,
      "candidats_codes": 7,
      "couverture": 0.777778,
      "variance": 1.959184,
      "D": 1.52381
    },
    "DEF-009": {
      "theme": "defense",
      "axe": "securite",
      "sens": 1,
      "candidats_codes": 2,
      "couverture": 0.222222,
      "variance": null,
      "D": null
    },
    "DEF-010": {
      "theme": "defense",
      "axe": "institutions",
      "sens": 1,
      "candidats_codes": 0,
      "couverture": 0,
      "variance": null,
      "D": null
    },
    "DEF-011": {
      "theme": "defense",
      "axe": "europe",
      "sens": 1,
      "candidats_codes": 2,
      "couverture": 0.222222,
      "variance": null,
      "D": null
    },
    "DEF-012": {
      "theme": "defense",
      "axe": "economie",
      "sens": 1,
      "candidats_codes": 1,
      "couverture": 0.111111,
      "variance": null,
      "D": null
    },
    "DEF-013": {
      "theme": "defense",
      "axe": "europe",
      "sens": -1,
      "candidats_codes": 4,
      "couverture": 0.444444,
      "variance": 0.75,
      "D": 0.333333
    },
    "DEF-014": {
      "theme": "defense",
      "axe": "europe",
      "sens": -1,
      "candidats_codes": 2,
      "couverture": 0.222222,
      "variance": null,
      "D": null
    },
    "ECO-001": {
      "theme": "economie-dette",
      "axe": "economie",
      "sens": 1,
      "candidats_codes": 3,
      "couverture": 0.333333,
      "variance": null,
      "D": null
    },
    "ECO-002": {
      "theme": "economie-dette",
      "axe": "economie",
      "sens": 1,
      "candidats_codes": 2,
      "couverture": 0.222222,
      "variance": null,
      "D": null
    },
    "ECO-003": {
      "theme": "economie-dette",
      "axe": "economie",
      "sens": 1,
      "candidats_codes": 3,
      "couverture": 0.333333,
      "variance": null,
      "D": null
    },
    "ECO-004": {
      "theme": "economie-dette",
      "axe": "economie",
      "sens": 1,
      "candidats_codes": 1,
      "couverture": 0.111111,
      "variance": null,
      "D": null
    },
    "ECO-005": {
      "theme": "economie-dette",
      "axe": "economie",
      "sens": 1,
      "candidats_codes": 0,
      "couverture": 0,
      "variance": null,
      "D": null
    },
    "ECO-006": {
      "theme": "economie-dette",
      "axe": "economie",
      "sens": 1,
      "candidats_codes": 4,
      "couverture": 0.444444,
      "variance": 1.1875,
      "D": 0.527778
    },
    "ECO-007": {
      "theme": "economie-dette",
      "axe": "economie",
      "sens": 1,
      "candidats_codes": 1,
      "couverture": 0.111111,
      "variance": null,
      "D": null
    },
    "ECO-008": {
      "theme": "economie-dette",
      "axe": "economie",
      "sens": 1,
      "candidats_codes": 0,
      "couverture": 0,
      "variance": null,
      "D": null
    },
    "ECO-009": {
      "theme": "economie-dette",
      "axe": "economie",
      "sens": 1,
      "candidats_codes": 2,
      "couverture": 0.222222,
      "variance": null,
      "D": null
    },
    "ECO-010": {
      "theme": "economie-dette",
      "axe": "economie",
      "sens": 1,
      "candidats_codes": 4,
      "couverture": 0.444444,
      "variance": 1.1875,
      "D": 0.527778
    },
    "ECO-011": {
      "theme": "economie-dette",
      "axe": "economie",
      "sens": -1,
      "candidats_codes": 2,
      "couverture": 0.222222,
      "variance": null,
      "D": null
    },
    "ECO-012": {
      "theme": "economie-dette",
      "axe": "economie",
      "sens": -1,
      "candidats_codes": 4,
      "couverture": 0.444444,
      "variance": 2.6875,
      "D": 1.194444
    },
    "ECO-013": {
      "theme": "economie-dette",
      "axe": "economie",
      "sens": -1,
      "candidats_codes": 4,
      "couverture": 0.444444,
      "variance": 1.1875,
      "D": 0.527778
    },
    "ECO-014": {
      "theme": "economie-dette",
      "axe": "economie",
      "sens": -1,
      "candidats_codes": 5,
      "couverture": 0.555556,
      "variance": 1.44,
      "D": 0.8
    },
    "ECO-015": {
      "theme": "economie-dette",
      "axe": "economie",
      "sens": -1,
      "candidats_codes": 4,
      "couverture": 0.444444,
      "variance": 2.25,
      "D": 1
    },
    "ECO-016": {
      "theme": "economie-dette",
      "axe": "economie",
      "sens": -1,
      "candidats_codes": 3,
      "couverture": 0.333333,
      "variance": null,
      "D": null
    },
    "ECO-017": {
      "theme": "economie-dette",
      "axe": "economie",
      "sens": -1,
      "candidats_codes": 0,
      "couverture": 0,
      "variance": null,
      "D": null
    },
    "ECO-018": {
      "theme": "economie-dette",
      "axe": "economie",
      "sens": -1,
      "candidats_codes": 2,
      "couverture": 0.222222,
      "variance": null,
      "D": null
    },
    "ECO-019": {
      "theme": "economie-dette",
      "axe": "economie",
      "sens": -1,
      "candidats_codes": 1,
      "couverture": 0.111111,
      "variance": null,
      "D": null
    },
    "ECO-020": {
      "theme": "economie-dette",
      "axe": "economie",
      "sens": -1,
      "candidats_codes": 4,
      "couverture": 0.444444,
      "variance": 0,
      "D": 0
    },
    "EDU-001": {
      "theme": "education",
      "axe": "economie",
      "sens": 1,
      "candidats_codes": 3,
      "couverture": 0.333333,
      "variance": null,
      "D": null
    },
    "EDU-002": {
      "theme": "education",
      "axe": "economie",
      "sens": 1,
      "candidats_codes": 1,
      "couverture": 0.111111,
      "variance": null,
      "D": null
    },
    "EDU-003": {
      "theme": "education",
      "axe": "economie",
      "sens": 1,
      "candidats_codes": 3,
      "couverture": 0.333333,
      "variance": null,
      "D": null
    },
    "EDU-004": {
      "theme": "education",
      "axe": "economie",
      "sens": 1,
      "candidats_codes": 1,
      "couverture": 0.111111,
      "variance": null,
      "D": null
    },
    "EDU-005": {
      "theme": "education",
      "axe": "economie",
      "sens": 1,
      "candidats_codes": 2,
      "couverture": 0.222222,
      "variance": null,
      "D": null
    },
    "EDU-006": {
      "theme": "education",
      "axe": "economie",
      "sens": 1,
      "candidats_codes": 3,
      "couverture": 0.333333,
      "variance": null,
      "D": null
    },
    "EDU-007": {
      "theme": "education",
      "axe": "economie",
      "sens": 1,
      "candidats_codes": 9,
      "couverture": 1,
      "variance": 1.358025,
      "D": 1.358025
    },
    "EDU-008": {
      "theme": "education",
      "axe": "economie",
      "sens": 1,
      "candidats_codes": 0,
      "couverture": 0,
      "variance": null,
      "D": null
    },
    "EDU-009": {
      "theme": "education",
      "axe": "economie",
      "sens": 1,
      "candidats_codes": 3,
      "couverture": 0.333333,
      "variance": null,
      "D": null
    },
    "EDU-010": {
      "theme": "education",
      "axe": "securite",
      "sens": -1,
      "candidats_codes": 4,
      "couverture": 0.444444,
      "variance": 1.25,
      "D": 0.555556
    },
    "EDU-011": {
      "theme": "education",
      "axe": "securite",
      "sens": -1,
      "candidats_codes": 1,
      "couverture": 0.111111,
      "variance": null,
      "D": null
    },
    "EDU-012": {
      "theme": "education",
      "axe": "economie",
      "sens": -1,
      "candidats_codes": 3,
      "couverture": 0.333333,
      "variance": null,
      "D": null
    },
    "EDU-013": {
      "theme": "education",
      "axe": "economie",
      "sens": -1,
      "candidats_codes": 4,
      "couverture": 0.444444,
      "variance": 0.1875,
      "D": 0.083333
    },
    "EDU-014": {
      "theme": "education",
      "axe": "economie",
      "sens": -1,
      "candidats_codes": 2,
      "couverture": 0.222222,
      "variance": null,
      "D": null
    },
    "EDU-015": {
      "theme": "education",
      "axe": "economie",
      "sens": -1,
      "candidats_codes": 2,
      "couverture": 0.222222,
      "variance": null,
      "D": null
    },
    "EDU-016": {